<?xml version="1.0" encoding="UTF-8"?>
<lista_de_notas xmlns:xsi="http://www.w3.org/2001/XMLSchema-instance"
 xsi:noNamespaceSchemaLocation="actividad19.xsd">
    <nota>
        <para>Pedro</para>
        <de>Laura</de>
        <titulo>Recordatorio</titulo>
        <contenido>A las 7:00 pm en la puerta del teatro </contenido>
    </nota>
    <nota dia="2010-01-23" hora="13:15:00">
        <para>Miguel</para>
        <de>Juan</de>
        <titulo>Informes</titulo>
        <contenido>Te he dejado los informes en el casillero</contenido>
    </nota>
</lista_de_notas>